{"$schema":"https://json-schema.org/draft/2020-12/schema","type":"object","required":["id","problem","target_users","outcome","acceptance_criteria","priority","decision_owner"],"properties":{"id":{"type":"string","minLength":1},"problem":{"type":"string","minLength":1},"target_users":{"type":"array","minItems":1,"items":{"type":"string","minLength":1}},"outcome":{"type":"string","minLength":1},"success_metrics":{"type":"array","items":{"type":"object","required":["name","direction"],"properties":{"name":{"type":"string"},"direction":{"enum":["increase","decrease","maintain"]},"target":{"type":"string"}}}},"acceptance_criteria":{"type":"array","minItems":1,"items":{"type":"string","minLength":1}},"priority":{"enum":["low","medium","high","critical"]},"dependencies":{"type":"array","items":{"type":"string"}},"risks":{"type":"array","items":{"type":"string"}},"release_strategy":{"type":"string"},"decision_owner":{"type":"string","minLength":1}},"additionalProperties":true}