{"id":"PO-142","problem":"Users abandon checkout when invoice data must be re-entered","target_users":["business buyers"],"outcome":"Reduce checkout abandonment caused by invoice entry","success_metrics":[{"name":"invoice_step_abandonment","direction":"decrease","target":"<= 8%"}],"acceptance_criteria":["Returning users can reuse a previously saved invoice profile","Invalid tax IDs show a clear correction message"],"priority":"high","dependencies":["billing-api"],"risks":["incorrect tax data reuse"],"release_strategy":"feature flag to 10% then ramp","decision_owner":"Product Owner"}